{
  "componentId": "h5.sheet",
  "tool": "pencil",
  "tokenBindings": [
    {
      "token": "component.h5.sheet.background",
      "target": "fill.surface"
    }
  ],
  "variantMappings": [
    {
      "variant": "size",
      "value": "sm",
      "target": "layout.size.sm"
    },
    {
      "variant": "size",
      "value": "md",
      "target": "layout.size.md"
    },
    {
      "variant": "size",
      "value": "lg",
      "target": "layout.size.lg"
    }
  ],
  "slotMappings": [],
  "stateMappings": [],
  "assetRefs": [],
  "syncRules": ["Sync size variants to documented component options."]
}
