{
  "componentId": "pc.button",
  "tool": "pencil",
  "tokenBindings": [
    {
      "token": "component.pc.button.background",
      "target": "fill.primary"
    }
  ],
  "variantMappings": [
    {
      "variant": "tone",
      "value": "primary",
      "target": "variant.tone.primary"
    },
    {
      "variant": "tone",
      "value": "secondary",
      "target": "variant.tone.secondary"
    }
  ],
  "slotMappings": [],
  "stateMappings": [],
  "assetRefs": [],
  "syncRules": ["Preserve component and token ids across sync."]
}
